{
  "schemaVersion": 1,
  "updatedAt": "2026-08-24",
  "ingredients": [
    { "key": "a-choy", "name": "油麦菜", "aliases": [], "shoppingCategory": "蔬菜", "pantryStaple": false },
    { "key": "beef-brisket", "name": "牛腩", "aliases": [], "shoppingCategory": "肉蛋水产", "pantryStaple": false, "purchaseTip": "选带少量筋膜、适合炖煮的牛腩块" },
    { "key": "bok-choy", "name": "小白菜", "aliases": ["小青菜"], "shoppingCategory": "蔬菜", "pantryStaple": false },
    { "key": "broccoli", "name": "西兰花", "aliases": ["青花菜"], "shoppingCategory": "蔬菜", "pantryStaple": false, "purchaseTip": "选花球紧实、颜色翠绿的" },
    { "key": "cabbage", "name": "包菜", "aliases": ["卷心菜", "圆白菜"], "shoppingCategory": "蔬菜", "pantryStaple": false },
    { "key": "carrot", "name": "胡萝卜", "aliases": ["红萝卜"], "shoppingCategory": "蔬菜", "pantryStaple": false },
    { "key": "celery", "name": "芹菜", "aliases": [], "shoppingCategory": "蔬菜", "pantryStaple": false },
    { "key": "century-egg", "name": "皮蛋", "aliases": ["松花蛋"], "shoppingCategory": "肉蛋水产", "pantryStaple": false },
    { "key": "chicken-breast", "name": "鸡胸肉", "aliases": ["鸡胸"], "shoppingCategory": "肉蛋水产", "pantryStaple": false, "purchaseTip": "选去皮鸡胸，回家切丁" },
    { "key": "chicken-thigh", "name": "鸡腿", "aliases": ["鸡腿肉", "去骨鸡腿"], "shoppingCategory": "肉蛋水产", "pantryStaple": false, "purchaseTip": "香煎用去骨鸡腿，炖菜可带骨" },
    { "key": "chicken-wing", "name": "鸡翅中", "aliases": ["翅中"], "shoppingCategory": "肉蛋水产", "pantryStaple": false },
    { "key": "chive", "name": "韭菜", "aliases": [], "shoppingCategory": "蔬菜", "pantryStaple": false },
    { "key": "cola", "name": "可乐", "aliases": [], "shoppingCategory": "其他", "pantryStaple": false },
    { "key": "cooking-oil", "name": "食用油", "aliases": ["炒菜油"], "shoppingCategory": "调味品", "pantryStaple": true },
    { "key": "corn", "name": "甜玉米", "aliases": ["玉米"], "shoppingCategory": "蔬菜", "pantryStaple": false },
    { "key": "cucumber", "name": "黄瓜", "aliases": [], "shoppingCategory": "蔬菜", "pantryStaple": false },
    { "key": "dark-soy-sauce", "name": "老抽", "aliases": ["老抽酱油"], "shoppingCategory": "调味品", "pantryStaple": true },
    { "key": "doubanjiang", "name": "豆瓣酱", "aliases": ["郫县豆瓣酱"], "shoppingCategory": "调味品", "pantryStaple": false },
    { "key": "dried-chili", "name": "干辣椒", "aliases": ["干红辣椒"], "shoppingCategory": "蔬菜", "pantryStaple": false },
    { "key": "egg", "name": "鸡蛋", "aliases": [], "shoppingCategory": "肉蛋水产", "pantryStaple": false },
    { "key": "garlic", "name": "蒜", "aliases": ["大蒜", "蒜瓣"], "shoppingCategory": "蔬菜", "pantryStaple": false },
    { "key": "garlic-sprout", "name": "蒜苔", "aliases": ["蒜薹"], "shoppingCategory": "蔬菜", "pantryStaple": false },
    { "key": "ginger", "name": "姜", "aliases": ["生姜"], "shoppingCategory": "蔬菜", "pantryStaple": false },
    { "key": "glass-noodle", "name": "粉丝", "aliases": ["绿豆粉丝"], "shoppingCategory": "其他", "pantryStaple": false },
    { "key": "green-garlic", "name": "蒜苗", "aliases": ["青蒜"], "shoppingCategory": "蔬菜", "pantryStaple": false },
    { "key": "green-pepper", "name": "青椒", "aliases": ["尖椒"], "shoppingCategory": "蔬菜", "pantryStaple": false },
    { "key": "ground-pork", "name": "猪肉末", "aliases": ["肉末", "猪肉馅"], "shoppingCategory": "肉蛋水产", "pantryStaple": false },
    { "key": "lettuce", "name": "生菜", "aliases": [], "shoppingCategory": "蔬菜", "pantryStaple": false },
    { "key": "light-soy-sauce", "name": "生抽", "aliases": ["生抽酱油"], "shoppingCategory": "调味品", "pantryStaple": true },
    { "key": "napa-cabbage", "name": "大白菜", "aliases": ["白菜"], "shoppingCategory": "蔬菜", "pantryStaple": false },
    { "key": "onion", "name": "洋葱", "aliases": [], "shoppingCategory": "蔬菜", "pantryStaple": false },
    { "key": "oyster-sauce", "name": "蚝油", "aliases": [], "shoppingCategory": "调味品", "pantryStaple": true },
    { "key": "peanut", "name": "花生米", "aliases": ["花生仁"], "shoppingCategory": "其他", "pantryStaple": false },
    { "key": "pickled-chili", "name": "泡椒", "aliases": [], "shoppingCategory": "调味品", "pantryStaple": false },
    { "key": "pork-belly", "name": "五花肉", "aliases": [], "shoppingCategory": "肉蛋水产", "pantryStaple": false, "purchaseTip": "选肥瘦分层、厚薄均匀的" },
    { "key": "pork-ribs", "name": "排骨", "aliases": ["肋排", "小排"], "shoppingCategory": "肉蛋水产", "pantryStaple": false, "purchaseTip": "炖汤选肋排，糖醋可选小排" },
    { "key": "pork-tenderloin", "name": "猪里脊", "aliases": ["里脊肉", "通脊"], "shoppingCategory": "肉蛋水产", "pantryStaple": false, "purchaseTip": "选颜色鲜红、适合快炒的里脊" },
    { "key": "potato", "name": "土豆", "aliases": ["马铃薯"], "shoppingCategory": "蔬菜", "pantryStaple": false },
    { "key": "rapeseed-greens", "name": "油菜", "aliases": ["油菜心"], "shoppingCategory": "蔬菜", "pantryStaple": false },
    { "key": "rock-sugar", "name": "冰糖", "aliases": [], "shoppingCategory": "调味品", "pantryStaple": false },
    { "key": "salt", "name": "盐", "aliases": ["食盐"], "shoppingCategory": "调味品", "pantryStaple": true },
    { "key": "scallion", "name": "小葱", "aliases": ["香葱"], "shoppingCategory": "蔬菜", "pantryStaple": false },
    { "key": "seaweed", "name": "干紫菜", "aliases": ["紫菜"], "shoppingCategory": "其他", "pantryStaple": false, "purchaseTip": "选无调味干紫菜" },
    { "key": "sesame-oil", "name": "香油", "aliases": ["芝麻油"], "shoppingCategory": "调味品", "pantryStaple": true },
    { "key": "shiitake", "name": "香菇", "aliases": ["冬菇"], "shoppingCategory": "蔬菜", "pantryStaple": false },
    { "key": "sichuan-pepper", "name": "花椒粉", "aliases": ["花椒面"], "shoppingCategory": "调味品", "pantryStaple": false },
    { "key": "silken-tofu", "name": "嫩豆腐", "aliases": ["南豆腐"], "shoppingCategory": "其他", "pantryStaple": false, "purchaseTip": "选嫩豆腐，保持完整包装运输" },
    { "key": "star-anise", "name": "八角", "aliases": ["大料"], "shoppingCategory": "其他", "pantryStaple": false },
    { "key": "starch", "name": "淀粉", "aliases": ["生粉"], "shoppingCategory": "调味品", "pantryStaple": true },
    { "key": "sugar", "name": "白糖", "aliases": ["细砂糖"], "shoppingCategory": "调味品", "pantryStaple": true },
    { "key": "sweet-bean-paste", "name": "甜面酱", "aliases": [], "shoppingCategory": "调味品", "pantryStaple": false },
    { "key": "sweet-potato-noodle", "name": "红薯粉条", "aliases": ["粉条"], "shoppingCategory": "其他", "pantryStaple": false },
    { "key": "tofu", "name": "北豆腐", "aliases": ["老豆腐"], "shoppingCategory": "其他", "pantryStaple": false, "purchaseTip": "煎炒选含水少、较结实的北豆腐" },
    { "key": "tomato", "name": "西红柿", "aliases": ["番茄"], "shoppingCategory": "蔬菜", "pantryStaple": false },
    { "key": "vinegar", "name": "香醋", "aliases": ["陈醋", "米醋"], "shoppingCategory": "调味品", "pantryStaple": true },
    { "key": "welsh-onion", "name": "大葱", "aliases": ["葱白"], "shoppingCategory": "蔬菜", "pantryStaple": false },
    { "key": "wood-ear", "name": "木耳", "aliases": ["黑木耳", "泡发木耳"], "shoppingCategory": "蔬菜", "pantryStaple": false, "purchaseTip": "可买干木耳，按泡发后重量使用" },
    { "key": "yam", "name": "山药", "aliases": [], "shoppingCategory": "蔬菜", "pantryStaple": false },
    { "key": "zucchini", "name": "西葫芦", "aliases": [], "shoppingCategory": "蔬菜", "pantryStaple": false }
  ],
  "dishIngredientRoles": {
    "tomato-egg": { "core": ["tomato", "egg"], "auxiliary": ["salt", "cooking-oil"], "optional": ["sugar"] },
    "hot-sour-potato": { "core": ["potato"], "auxiliary": ["dried-chili", "vinegar", "salt", "cooking-oil"], "optional": [] },
    "hand-torn-cabbage": { "core": ["cabbage"], "auxiliary": ["garlic", "dried-chili", "light-soy-sauce", "vinegar", "cooking-oil"], "optional": [] },
    "garlic-broccoli": { "core": ["broccoli"], "auxiliary": ["garlic", "salt", "cooking-oil"], "optional": [] },
    "oyster-lettuce": { "core": ["lettuce"], "auxiliary": ["garlic", "oyster-sauce", "cooking-oil"], "optional": [] },
    "chive-egg": { "core": ["chive", "egg"], "auxiliary": ["salt", "cooking-oil"], "optional": [] },
    "zucchini-egg": { "core": ["zucchini", "egg"], "auxiliary": ["salt", "cooking-oil"], "optional": [] },
    "scallion-tofu": { "core": ["tofu"], "auxiliary": ["scallion", "light-soy-sauce", "cooking-oil"], "optional": [] },
    "pepper-pork": { "core": ["pork-belly", "green-pepper"], "auxiliary": ["garlic", "light-soy-sauce", "doubanjiang", "cooking-oil"], "optional": [] },
    "kung-pao-chicken": { "core": ["chicken-breast", "peanut"], "auxiliary": ["dried-chili", "welsh-onion", "light-soy-sauce", "vinegar", "sugar", "starch", "cooking-oil"], "optional": [] },
    "fish-fragrant-pork": { "core": ["pork-tenderloin", "wood-ear", "carrot", "green-pepper"], "auxiliary": ["pickled-chili", "light-soy-sauce", "vinegar", "sugar", "starch", "cooking-oil"], "optional": [] },
    "mapo-tofu": { "core": ["silken-tofu", "ground-pork"], "auxiliary": ["doubanjiang", "sichuan-pepper", "light-soy-sauce", "starch", "cooking-oil"], "optional": [] },
    "cola-wings": { "core": ["chicken-wing", "cola"], "auxiliary": ["ginger", "light-soy-sauce", "dark-soy-sauce"], "optional": [] },
    "braised-chicken": { "core": ["chicken-thigh", "shiitake", "potato"], "auxiliary": ["green-pepper", "ginger", "light-soy-sauce", "dark-soy-sauce", "cooking-oil"], "optional": [] },
    "potato-ribs": { "core": ["pork-ribs", "potato"], "auxiliary": ["ginger", "welsh-onion", "light-soy-sauce", "dark-soy-sauce", "cooking-oil"], "optional": [] },
    "tomato-beef-stew": { "core": ["beef-brisket", "tomato", "potato"], "auxiliary": ["onion", "ginger", "salt"], "optional": [] },
    "twice-cooked-pork": { "core": ["pork-belly", "green-garlic"], "auxiliary": ["doubanjiang", "sweet-bean-paste", "ginger", "cooking-oil"], "optional": [] },
    "mushroom-chicken": { "core": ["chicken-thigh", "shiitake"], "auxiliary": ["ginger", "light-soy-sauce", "oyster-sauce", "starch", "cooking-oil"], "optional": [] },
    "onion-pork": { "core": ["pork-tenderloin", "onion"], "auxiliary": ["light-soy-sauce", "starch", "cooking-oil"], "optional": [] },
    "cabbage-pork-noodle-stew": { "core": ["pork-belly", "napa-cabbage", "sweet-potato-noodle"], "auxiliary": ["ginger", "light-soy-sauce", "dark-soy-sauce"], "optional": [] },